issue_id,issue_name,severity,affected_file,affected_function,affected_configs,affected_phase,affected_slippage,current_behavior,expected_behavior,can_invalidate_results,fix_required,status
EOM001,ARTIFICIAL_EOM_INCLUDED_IN_METRICS,CRITICAL,maximum_confirmation_rerun/max_confirmation_rerun.py,run_confirmation,"CFG_001;CFG_002;CFG_003;CFG_004;CFG_005","TRAIN;VAL;TEST","0.0;0.2","ARTIFICIAL_TRUNCATION rows were counted in primary metrics","Artificial EOM must be excluded from primary metrics and audited",YES,YES,FIXED_VERIFIED_ZERO_IN_METRICS
EOM002,SUBSECOND_DEADLINE_FALSE_TRUNCATION,HIGH,src/v7_engine/engine.py;maximum_confirmation_rerun/max_confirmation_rerun.py,simulate_position/run_confirmation,"CFG_001;CFG_002;CFG_003;CFG_004;CFG_005","TRAIN;VAL;TEST","0.0;0.2","actual_tick_window_end could land milliseconds before intended_position_end and become artificial EOM","Execution window must include a real tail beyond intended end or exclude fail-closed",YES,YES,FIXED_VERIFIED_FAIL_CLOSED
EOM003,MONTHLY_EXECUTION_WINDOW_CUTOFF,HIGH,maximum_confirmation_rerun/max_confirmation_rerun.py,load_month_ticks/run_confirmation,"CFG_001;CFG_002;CFG_003;CFG_004;CFG_005","TRAIN;VAL;TEST","0.0;0.2","Execution could be limited to current monthly tick file","Execution ticks may include next-month ticks only for position resolution, not signal generation",YES,YES,FIXED_VERIFIED_EXECUTION_ONLY
EOM004,MISSING_EOM_METRIC_GUARDS,HIGH,maximum_confirmation_rerun/max_confirmation_rerun.py,calc_metrics,"CFG_001;CFG_002;CFG_003;CFG_004;CFG_005","TRAIN;VAL;TEST","0.0;0.2","PF and expectancy did not have a shared EOM integrity gate","Metric calculation must use included_in_metrics=false for artificial or incomplete EOM",YES,YES,FIXED_VERIFIED_INDEPENDENT_MATCH
EOM005,HEAD_BASED_TRUNCATION_REGRESSION_GUARD,MEDIUM,gate6_mini_runner.py,position window construction,ALL,ALL,ALL,"Prior regression risk: fixed scanned count could silently define the tick window","No head(N) truncation is allowed for position validity",YES,YES,GUARDED_BY_TARGETED_AND_FULL_SUITE
